{"brand":{"name":"Feltwillow"},"canonicalization":"feltwillow-canonical-json-v1","default_language":"en","example":true,"kind":"web-bundle","languages":[{"label":"English","language":"en","path":"/en/"}],"media":{"cover-lion-and-mouse":{"bytes":74,"duration_ms":null,"height":9,"media_type":"image/png","path":"media/acb7367bf5a1f78f2efdd23c958bebc6f0450a29c3746feb37a9fa1a476be441.png","sha256":"acb7367bf5a1f78f2efdd23c958bebc6f0450a29c3746feb37a9fa1a476be441","source":{"asset_id":"cover-lion-and-mouse","release_id":"lion-and-mouse.en.r0001"},"width":9},"illus-fixture-01":{"bytes":77,"duration_ms":null,"height":9,"media_type":"image/png","path":"media/31df5e30f608460ad0514e3850cb487a67ddb47a83317a03f6eacf7bd4a2211d.png","sha256":"31df5e30f608460ad0514e3850cb487a67ddb47a83317a03f6eacf7bd4a2211d","source":{"asset_id":"illus-fixture-01","release_id":"fixture-second-story.en.r0001"},"width":16},"illus-s01-explores-start":{"bytes":77,"duration_ms":null,"height":9,"media_type":"image/png","path":"media/98c4fa30871386aab3c00aae45ab15847f0567ca3ccc21b37729a86f7af051c3.png","sha256":"98c4fa30871386aab3c00aae45ab15847f0567ca3ccc21b37729a86f7af051c3","source":{"asset_id":"illus-s01-explores-start","release_id":"lion-and-mouse.en.r0001"},"width":16}},"origin":null,"pages":[{"blocks":[{"text":"EXAMPLE ONLY: owner-approved about text pending.","type":"paragraph"}],"language":"en","page_id":"about","path":"/en/about/","title":"EXAMPLE ONLY: About"},{"blocks":[{"text":"EXAMPLE ONLY: approved privacy text pending.","type":"paragraph"}],"language":null,"page_id":"privacy","path":"/privacy/","title":"EXAMPLE ONLY: Privacy"}],"redirects":[],"schema_version":2,"site_set":{"sha256":"b0244a899ebed151ada502b95cc73e5a6c069436bb6d7b64eb5fb14ac28129b5","site_set_id":"example-site-set-0002"},"stories":[{"age_max":7,"age_min":3,"blocks":[{"level":2,"text":"EXAMPLE ONLY: part one","type":"heading"},{"text":"EXAMPLE ONLY: the approved reading edition has not been supplied.","type":"paragraph"},{"alt":"EXAMPLE ONLY: alt text pending review.","asset_id":"illus-s01-explores-start","caption":null,"type":"image"},{"speaker":"EXAMPLE Mouse","text":"EXAMPLE ONLY: a line of dialogue.","type":"quote"}],"cover":{"alt":"EXAMPLE ONLY: cover alt text pending review.","asset_id":"cover-lion-and-mouse"},"language":"en","listening":{"duration_ms":null,"links":[],"player":{"type":"none"}},"moral":"EXAMPLE ONLY: replace with the approved moral.","path":"/en/stories/the-lion-and-the-mouse/","published_at":null,"reading_divergence":"not-applicable","release":{"release_id":"lion-and-mouse.en.r0001","release_sha256":"e6e18a2dc62a735c64170913844147cbb2db18f39440132e0f15281bd922ac12"},"story_id":"lion-and-mouse","summary":"EXAMPLE ONLY: replace with the owner-approved public description.","title":"The Lion and the Mouse","transcript":null,"updated_at":null,"video":null},{"age_max":8,"age_min":3,"blocks":[{"text":"EXAMPLE ONLY: first paragraph.","type":"paragraph"},{"alt":"EXAMPLE ONLY: fixture alt text.","asset_id":"illus-fixture-01","caption":"EXAMPLE ONLY: caption.","type":"image"},{"text":"EXAMPLE ONLY: paragraph after the illustration.","type":"paragraph"}],"cover":null,"language":"en","listening":{"duration_ms":null,"links":[],"player":{"type":"none"}},"moral":"EXAMPLE ONLY.","path":"/en/stories/fixture-second-story/","published_at":null,"reading_divergence":"identical","release":{"release_id":"fixture-second-story.en.r0001","release_sha256":"ad92d63226cdb130a442e9cb2a93c38a9008d1c34877141e609496e89ee63acf"},"story_id":"fixture-second-story","summary":"EXAMPLE ONLY: synthetic fixture used to prove complete site-sets.","title":"EXAMPLE ONLY: synthetic second story","transcript":null,"updated_at":null,"video":null}],"trailing_slash":"always"}