{"brand":{"name":"Feltwillow"},"canonicalization":"feltwillow-canonical-json-v1","default_language":"en","example":true,"kind":"web-bundle","languages":[{"label":"English","language":"en","path":"/en/"}],"media":{"cover-lion-and-mouse":{"bytes":74,"duration_ms":null,"height":9,"media_type":"image/png","path":"media/acb7367bf5a1f78f2efdd23c958bebc6f0450a29c3746feb37a9fa1a476be441.png","sha256":"acb7367bf5a1f78f2efdd23c958bebc6f0450a29c3746feb37a9fa1a476be441","source":{"asset_id":"cover-lion-and-mouse","release_id":"lion-and-mouse.en.r0001"},"width":9},"illus-s01-explores-start":{"bytes":77,"duration_ms":null,"height":9,"media_type":"image/png","path":"media/98c4fa30871386aab3c00aae45ab15847f0567ca3ccc21b37729a86f7af051c3.png","sha256":"98c4fa30871386aab3c00aae45ab15847f0567ca3ccc21b37729a86f7af051c3","source":{"asset_id":"illus-s01-explores-start","release_id":"lion-and-mouse.en.r0001"},"width":16}},"origin":null,"pages":[{"blocks":[{"text":"EXAMPLE ONLY: owner-approved about text pending.","type":"paragraph"}],"language":"en","page_id":"about","path":"/en/about/","title":"EXAMPLE ONLY: About"},{"blocks":[{"text":"EXAMPLE ONLY: approved privacy text pending.","type":"paragraph"}],"language":null,"page_id":"privacy","path":"/privacy/","title":"EXAMPLE ONLY: Privacy"}],"redirects":[],"schema_version":2,"site_set":{"sha256":"a32c4d3ef9a0c255629b07bed7315258dab8113138be38931d8315f18a60bf74","site_set_id":"example-site-set-0001"},"stories":[{"age_max":7,"age_min":3,"blocks":[{"level":2,"text":"EXAMPLE ONLY: part one","type":"heading"},{"text":"EXAMPLE ONLY: the approved reading edition has not been supplied.","type":"paragraph"},{"alt":"EXAMPLE ONLY: alt text pending review.","asset_id":"illus-s01-explores-start","caption":null,"type":"image"},{"speaker":"EXAMPLE Mouse","text":"EXAMPLE ONLY: a line of dialogue.","type":"quote"}],"cover":{"alt":"EXAMPLE ONLY: cover alt text pending review.","asset_id":"cover-lion-and-mouse"},"language":"en","listening":{"duration_ms":null,"links":[],"player":{"type":"none"}},"moral":"EXAMPLE ONLY: replace with the approved moral.","path":"/en/stories/the-lion-and-the-mouse/","published_at":null,"reading_divergence":"not-applicable","release":{"release_id":"lion-and-mouse.en.r0001","release_sha256":"e6e18a2dc62a735c64170913844147cbb2db18f39440132e0f15281bd922ac12"},"story_id":"lion-and-mouse","summary":"EXAMPLE ONLY: replace with the owner-approved public description.","title":"The Lion and the Mouse","transcript":null,"updated_at":null,"video":null}],"trailing_slash":"always"}